,Text
12060,"The teacher was lazy and just copied and pasted generic responses that did not go with my work. For Example if i turned something in late its poor grade was reflected but then under it was written, ""great job turning your assignment on time and continue your excellant work., ...etc etc. The online classroom was not set up correctly and a few areas said things like,,,""talk about students assignments here.."" Different areas of the classroom also listed different assignments."
12228,She was not very clear with when papers were due she would say they were due the next day and you would have them done then she would say next week. She wasted a lot of time just talking about stuff not important. Her study guides for tests would never ask questions that helped with the test.
12395,"Lots of us in Ms. C's class believed that Ms. C played favorites. Also, Ms. C gives a lot projects, which makes it easy to get an A but doesn't help in English"
12563,I'm not exactly sure who is giving her all these good ratings. Ms Dulko takes powerpoints from the internet and tries to lecture on them. She has no idea what she is talking about and has awful grading policies. This woman puts absolutely no effort into teaching and never gives anything back.
12730,"Mr.Vogel thinks that his assignments are ""fun"" but they are just annoying and confusing and on top of all our other works it was just a waste of time!"
12898,"I had her for regents chem. She is smart, but cannot teach at all. Just really bad with kids. Terrible at communicating. High tendency to lose assignments for kids, and then will blame them for not turning it in."
13065,Worst teacher I have ever had. Cannot learn anything in her class! She tests over things she has never gone over with us. Will hold work until its late then put it in skyward with less points. Very weird and strict with students.
13233,she needs to stop talking for one two stop giving us work on work on work and three kids like to talk in class its what kids do
13400,"The classroom is so desolate and the teacher so unpleasant that you lose motivation. You will learn at the cost of extreme boredom and hatred. Nitpicks minor mistakes making tests easy to flunk.Scoffs when you have an error in your work.Daily homework +30 minutesKeeps obvious favoritesCan't admit when she makes a mistake, therefore there will be nothing you can do when she makes a grading errorThis class will lower your GPAYOU DO NOT NEED A STRICT, BORING CLASS IN ORDER TO LEARN"
13568,arg! way way too much hw... its all busy work... it doesnt help at all... he doesnt help at all. nice guy tho
13735,mr. thompson is completely unfair. we do get to go outside but he plays faves and gives whatever grade he wants. he's pretty nice but isn't clear in his teachings and is sometimes irresponsible.
13903,She is a great teacher until you mess up once. Then she ruins your grade in the class and tells you you are rude and disrespectful. She has made me hate my favorite subject.
14070,This teacher expects everyone who leaves her class to become better humans. She does not believe in grades and will not give you your grades back on test and other assignments. She expects the students to believe that grades are not important and colleges will understand that. Homework consisted of reading 15 to 30 pages of a book a night followed by questions. There are pop assessments that will test your ability to remember most of details that happened throughout the book. Discussion styled
14238,He is so caught up in physics that he doesn't even realize that no one understands what he's talking about. Mr. Felczan assigns way to many labs that students can't keep up. Most of class time is spent in labs and the day after we are given one lab he will assign another.
14405,"Mrs. Fernandez gives no homework to her students and we sing a lot, but I do not recommend her as a teacher. She is quite confusing for example she said, ""You guys can take your choir folders home, but they have to be here everyday."" What does that even mean? Mrs. Fernandez has us do ridiculous warm-ups and we barely sung this past month (mainly because we've being working on Singing Valentines, but still). She also does not manage time very well I wish Lawson would fire Mrs. Fernandez!!!!!!!!!!"
14573,"I had her in sixth grade, and she's actually the worst teacher I've ever had. For some ungodly reason, she would not give textbooks to students and would give out obscene amounts of homework to 11-year-olds. Because I had no book, I had to do a web crawl every night to find out how the planet's alignments worked and it literally took two hours. It was like an AP Bio class, not a sixth grade science class. She is also mean, and I'm very mild-mannered."
14740,"I am torn. I like Carl, but this schedule disagrred with me at times: Copy list/schedule, discuss something at Carl's leasure. Busywork. Good grades?"
14908,"Moody and clearly unused to teaching a classroom class (AP Art History). Be prepared to do all your work at home while she reads out of the textbook during class. We have done nothing but tests and powerpoints almost the whole time, and she loses our assignments constantly and gets cranky when we ask to see our grades so we never find out until report cards come."
15075,"Mrs. P is not a great teacher. Her classroom ethics involve favoritism and picking on kids who she does not really like, whether they deserve it or not. Her grading is very silly, as we have to go above and beyond what she asks us to get a decent grade on an assignment, and that is usually not enough (her favorites get A's, the rest do not...). She thinks her class is a college class, but she assigns and grades our projects based on creativity, rather then content."
15243,"Expect nothing but endless busy work and projects. Projects that you aren't given enough time to do and are explained extremely poorly. During time we could be asking questions about said projects, she decides to pile on more and more busy work. You won't learn a single thing the entire course. If you can, SWITCH OUT OF HER CLASS. I can't emphasize that enough. Horrible, biased, rude, and honestly pretty unintelligent. There's not much I can say that has not been said already. Please FIRE HER."
15410,"Mr. Labonne's way of analyzing the readings in class is a bit objective; I wish that there were open-ended discussions. Hw should be explained more precisely, & late hw should be accepted, esp. if caused by misunderstanding."
15578,"Ms Tisdale is the worst history teacher at IND! She was always late to class if we had her the first class of the day! Went way off topic during class. Never posted homework or grades on edline. Does not teach well because when it comes time for the test, you have no idea what any of the answers are. It is a teach yourself class!!"
15745,"I took this class because I really wanted to learn.The atmosphere is too loose. Everything is disorganized, and we never got to building models. Disappointing!"
15913,unclear on instructions and bad at explaining things. leaves a lot to go to soccer games. doesn't do much teaching and instead gives worksheets with little notes.
16080,Ms.Caskey omg dont even get me started she is the worst teacher there is to be she never helps me and if she does she gives me this attitude and she never makes anything fun she gives us an hour of work and then crams in a 2 minute lesson that I can't even pay attention to because I'm finishing my work another thing Is we just started a book like 5 days ago and she expects us to on page 188 what do u think we r this is the technology century not the book and skating type
16248,"worst teacher, doesnt explain things, gives attitude, gives projects that no one understands, picks favorites, needs to learn how to be a teacher and mature"
16415,"Class is HARD. She teaches twice a week. Monday and Friday are days dedicated to quizzes. Friday is our ""reading day"" and she also takes a day off to be lazy Tuesday, Wednesday, or Thursday. Awful, awful class. She doesn't even have a good personality, just and ego because she's a doctor. YOU ARE A TEACHER HUN"
16583,"Mrs. Buote is, frankly, the worst teacher I have ever had. She literally taught our class nothing about art, yet clearly favored the students who were already good at it without her instruction. She also actually had the nerve to draw over student's work without even telling them what she was going to do. The homework assignments had nothing to do with the class assignment and she barely ever told us what they were, anyway. Honestly, her art is decent enough, but clearly not so good that she can do anything"
