,Text
9190,great theater teacher but hardly cares about her english class. She will lose papers and she will blame YOU for it!
9303,I didn't enjoy having her as a teacher she was a good person but she doesn't know how to teach a class. She assigned to much busy work that didn't improve our learning experience at all.
9417,"Mr. Camacho was my History teacher who was supposed to teach our class in spanish because I'm in the dual language program. He ended up giving us articles in Spanish the whole year that we had to annotate, answer 3-4 questions, write a summary, and vocabulary. Many times the class didn't understand and were no able to receive help from Mr. Camacho. When he wanted to give us tests he gave them to us in English because he was too lazy to translate it into Spanish. I learned nothing in his class!"
9530,its obvious that he does everything possible to take up class time.. while lecturing he stopped and asked each of the 20 something students what their favorite book was.. obviously relevant
9644,"I had Mr. Kozak last year unfortunately. Mr. Kozak takes his studio art class too seriously for what it is. I am going to be accepted into no colleges because of him. It is a studio art class, it is NOT an AP course, which he takes it as. He gives grades for participation, but he asks approximately 2 questions and expects the whole class to answer. I once answered every single question he asked and I still got a grade that dropped my overall average. He gets me so infuriated."
9757,"Good teachers do not yell and scream at her students and assign busy work - lots of coloring.
If your child does not like coloring; opt out of her class asap.
Lots of valuable study time wasted due to"
9871,"She's nice, but not a good teacher. It seemed she spent more time putting her outfits together than organizing the class and assignments. I can't remember when she actually taught the class. Asking her questions is a waste of time because you get a very vague and generally unhelpful answer. Would not recommend."
9984,Never puts in grades and gets mad at me sleeping during her class when she doesn't even put any sense of effort into a good lecture/lesson/anything for spanish 5 AP. She always seems unprepared and ca
10097,"Had her class for about a few weeks and almost went insane. She is far from the greatest Spanish teacher at the school. Just hope you dont get her class, and if you do, try to get La Rhonda Ventura instead. Just try to keep away from her."
10211,"Mrs. Cooper is one of the worst teachers I have ever had. She does not teach in class but tells you to go online or to come after school. Maybe I am confused, but isn't the class time for teaching!"
10324,She is the worst English teacher I have had through all four years of high school. She can't command control of the class and her tests are absolutely nothing like what she tells us they are going to
10438,"I've never wanted to die more than ever with him being my teacher. I'm in several AP/AICE classes and have had A's in all of them, however, with me being in his Chemistry Honors class, I have barely had a C. I've never been so over joyed for getting a D on a test before in my life. If you get him, I have one piece of advice for you. You should laminate your homework and notes so the tears just roll off."
10551,"wurst class ever. i got marked down on my decade assignment because i had ""too much information"".Too much info? Hows that possible. Sorry kc, didnt no u want a quarter of a page instead of a half."
10665,"He always gave extra credit for doing absolutely nothing, and was fired for having an objectionable search history."
10778,"Yep, he was ridiculously funny! But the material was about as clear as mud. He's not a teacher, he's an in-class comedian. Since most people don't go to his class to learn, they don't have a problem. If you are there because you want to learn, and not just the surface stuff, seriously consider asking for another teacher. I didn't learn anything in this class. He hates questions about the material. How can you be a TEACHER and hate QUESTIONS? However, I HAVE heard that he's improved slightly recently."
10892,I have taken Spanish for three years and loved the subject and this woman made me never want to never utter a single word of Spanish ever again. I have had some bad teachers in the past but at least they were not as much of a horrible human being as her. She honestly hates children. I am a straight A student who struggled through her class because she taught us nothing. I think she actually liked assigning things for the sole purpose of lowering everyone's grade. No person I've met likes her.
11005,"Mr. Caruso was my least favorite teacher in middle school. He is was so so so so annoying. He acted like this nice guy but was actually so rude to people in my class. All he ever did was yell at us for not raising our hand every single time he asked a question, talk about his books, or tell some useless story. I talked to people in other classes in it seemed that he rehearsed everything he would say in every class and say the same thing over and over. Awful teacher don't recommend."
11119,"I had Mrs. Hames over 10 years ago. At open house, parents asked her why most of the class had ""D's"" and ""F""s"". Her response was ""That's what they earned."" She will not help you at all. Her lectures were few and far between. Had many interruptions during class that did not pertain to school/learning."
11232,"Mr. Campe is a really nice guy and it is clear that he has devoted his lifetime to teaching math of all levels to the future of America. That being sad, his class was a complete joke and if I have to do another proof in my life I will freak out! He couldn't really teach at all (and this is coming from someone going to school for teaching). His class really made me hate junior year overall."
